,,,,,,,,,,,,,,,,,,,,,,,,,,,,,,,,,,,,,,,,,,,,
Dataset: Input-Output Tables,,,,,,,,,,,,,,,,,,,,,,,,,,,,,,,,,,,,,,,,,,,,
Variable,,DOMIMP: Domestic output and imports,,,,,,,,,,,,,,,,,,,,,,,,,,,,,,,,,,,,,,,,,,
Country,,CHN: China (People's Republic of),,,,,,,,,,,,,,,,,,,,,,,,,,,,,,,,,,,,,,,,,,
Time,,2004,,,,,,,,,,,,,,,,,,,,,,,,,,,,,,,,,,,,,,,,,,
Unit,,"US Dollar, Millions",,,,,,,,,,,,,,,,,,,,,,,,,,,,,,,,,,,,,,,,,,
,,1,2,3,3,3,3,3,3,3,3,3,3,3,3,3,3,3,3,4,5,6,6,7,7,6,6,6,7,8,9,7,7,9,9,10,10,10,10,10,13,12,12,13
Column sector (to:),,"C01T05: Agriculture, hunting, forestry and fishing",C10T14: Mining and quarrying,"C15T16: Food products, beverages and tobacco","C17T19: Textiles, textile products, leather and footwear",C20: Wood and products of wood and cork,"C21T22: Pulp, paper, paper products, printing and publishing","C23: Coke, refined petroleum products and nuclear fuel",C24: Chemicals and chemical products,C25: Rubber and plastics products,C26: Other non-metallic mineral products,C27: Basic metals,C28: Fabricated metal products,"C29: Machinery and equipment, nec","C30T33X: Computer, Electronic and optical equipment","C31: Electrical machinery and apparatus, nec","C34: Motor vehicles, trailers and semi-trailers",C35: Other transport equipment,C36T37: Manufacturing nec; recycling,"C40T41: Electricity, gas and water supply",C45: Construction,C50T52: Wholesale and retail trade; repairs,C55: Hotels and restaurants,C60T63: Transport and storage,C64: Post and telecommunications,C65T67: Financial intermediation,C70: Real estate activities,C71: Renting of machinery and equipment,C72: Computer and related activities,C73T74: R&D and other business activities,C75: Public administration and defence; compulsory social security,C80: Education,C85: Health and social work,"C90T93: Other community, social and personal services",C95: Private households with employed persons,HFCE: Households final consumption expenditure,NPISH: Non-profit institutions serving households,GGFC: General Government final consumption,GFCF: Gross Fixed Capital Formation,INVNT: Changes in inventories,CONS_ABR: Direct purchases abroad by residents (imports),CONS_NONRES: Direct purchases by non-residents (exports),EXPO: Exports (cross border),IMPO: Imports (cross border)
Row sector (from:),,,,,,,,,,,,,,,,,,,,,,,,,,,,,,,,,,,,,,,,,,,,
"IMP_C01T05: Agriculture, hunting, forestry and fishing",1,786.4,11,3643.4,1777.3,314,119.8,2.1,241.3,171.6,2.4,3.4,1.3,3.4,8.7,2.1,1.7,0.4,302.8,0.1,3.8,0.4,2.9,0.9,0.1,0.1,0.1,0,0.1,0.4,0.1,0.1,0.3,0.3,0,4365,0,86.9,491.9,177.6,7.4,0,0,12531.2
IMP_C10T14: Mining and quarrying,2,142,2269.5,248,371.1,103.5,154.1,17128.1,5302.5,145,3520,1416.8,4833.5,573.1,162.5,221.2,153.3,40.7,157.5,73.8,29,0.5,1.2,2019.3,0.4,0.1,1.6,0,0.4,1.8,1.1,1.6,1.8,2,0,628.2,0,0.2,15.5,749.2,5,0,0,38461.3
"IMP_C15T16: Food products, beverages and tobacco",3,494,10.9,2253.5,629.5,25,19.9,22.1,246.7,38.8,13.9,28.8,23.1,41.3,251.2,60.1,29.6,10.9,51.5,0.7,2019.7,2019.5,18.2,1.5,0.6,0.3,0.5,0,0.3,1.4,0.3,0.8,2,2019.3,0,4236.4,0,3.4,48.7,242.6,1546.5,0,0,10362.2
"IMP_C17T19: Textiles, textile products, leather and footwear",3,5.1,12.8,15.9,8253.2,34.1,49.4,3.9,65.8,105.6,11,2019.1,12.9,44.3,331.8,71.5,59.9,6.9,347.4,0.7,2019.5,2019.6,0.7,2019.2,0.9,0.3,0.7,0,0.5,2.4,3.2,0.5,2019.5,2019.1,0,3172.1,0,0.1,24.2,26.7,927.8,0,0,13625.3
IMP_C20: Wood and products of wood and cork,3,7.7,18.4,10.2,26.8,795.2,73,1.9,18.4,17.4,22.3,124.4,5.9,41.1,180.6,65.1,22.3,8.9,291.6,0.5,70.5,1.1,0.6,1.1,0.3,0.1,0.3,0,0.4,1.8,4.2,5.8,4.9,3.6,0,48.3,0,0.1,8.2,0.6,7.4,0,0,1891.3
"IMP_C21T22: Pulp, paper, paper products, printing and publishing",3,27.1,26.1,725.5,690.3,125.4,3417.9,8.9,456.2,251.5,280.4,257.7,20.4,171.4,1837.1,672.3,87,40.2,419.9,4.2,7.1,38.4,3.6,5.9,43.6,2019.6,6.2,1.3,2019.5,79.7,43.8,33.5,2019.3,48.7,0,144,0,4.4,22,145.8,9.2,0,0,10205.2
"IMP_C23: Coke, refined petroleum products and nuclear fuel",3,277.3,466.8,108.8,259.4,67.3,83.9,596.8,2544.6,185.1,424.5,374.9,788,336.9,215.5,154,127.2,61.9,117.5,323.7,414,57.9,23.3,1460.8,19.5,23.3,75.3,2.1,30.3,130.4,77.4,32.6,25.3,67.3,0,232.6,0,0.4,13,3.5,128.9,0,0,10332.1
IMP_C24: Chemicals and chemical products,3,1650,405.7,469.8,5898.6,820.8,1294.6,240.9,12724.1,7759.7,811.4,928.3,290.1,605.2,8238.2,2158.8,635.7,214.5,938.2,11.9,157.2,2019.9,7.5,18.2,6.8,4.7,2019.9,0.7,10.7,46.1,12.5,11.8,486.5,85.3,0,2554.6,0,1.9,68.4,441.7,369.3,0,0,50414.3
IMP_C25: Rubber and plastics products,3,57.6,66.5,242.2,315.7,41.6,161.8,8.6,352.4,1409.9,62.1,155.1,17.9,354.8,1975.6,739.2,367.5,79.9,203.9,4.4,48.7,2019.3,3.1,2019.8,4.4,0.3,6.3,0.1,2,8.7,1.2,2.5,6.6,8,0,278.4,0,0.1,88.5,84,11.4,0,0,7204.2
IMP_C26: Other non-metallic mineral products,3,8.5,2019.9,41.6,33.1,12.9,7.5,15.1,60.3,18.6,281,57.4,64.8,46.1,1342.6,172.9,38.2,8.5,45.1,1.1,156.4,0.4,0.5,1,0.5,0.2,2019.1,0,0.3,1.5,1,1.3,1.8,1,0,90.9,0,0.2,25.2,1.2,3.5,0,0,2575.5
IMP_C27: Basic metals,3,12.6,317.3,31.9,64.3,99.2,75.8,201,248.4,154.3,204.2,6285.9,4353.1,4551.3,5852.1,8586.3,1877.9,527.7,654.4,7.8,1457.5,2.5,0.3,19,1.1,0.1,10.7,0.2,3,12.9,0.2,2.7,1.3,7,0,48.8,0,0.2,57.9,67.4,5.3,0,0,35803.5
IMP_C28: Fabricated metal products,3,14.7,56.6,49,63.9,53.7,39.5,13.2,74,60,74.2,881.1,90.3,459,1807.8,640.5,161.5,74.9,161.1,18.4,297.3,4.9,2.9,11.3,13.6,2.1,2019.1,0.8,11.4,49.2,7,4.6,6.8,8.2,0,175.5,0,0.3,581.4,18.9,22.4,0,0,6036.1
"IMP_C29: Machinery and equipment, nec",3,212.6,920,133.8,718.3,128.2,182.2,219.4,583,287.2,416.8,1377.1,677.7,8249,3932.7,2343.5,2716,1251.6,109.5,107.9,508.9,46.4,5.7,149.4,63.9,16.8,40.9,1.3,18.9,81.2,8.2,14.7,174.4,14.1,0,111.5,0,0.8,23322,328.1,364.5,0,0,49838.2
"IMP_C30T33X: Computer, Electronic and optical equipment",3,72.2,441.8,67.4,171.6,22,283.1,73.6,363,147.8,128.5,284.7,86.5,2119.3,80653.3,3177.6,735.2,557.5,128.7,220.1,285.5,159.4,7,75.7,1267,87.6,74.1,20.4,295.5,1271.4,111.2,141.6,49,350.4,0,8282.2,0,2.5,27656.7,1453.5,744.5,0,0,132069.2
"IMP_C31: Electrical machinery and apparatus, nec",3,11.5,149.4,33.5,110.1,20.3,50.4,23.8,78.8,48.3,39.4,163.9,61.2,1215.8,7867.2,4110.9,572.5,308.6,62.7,96.4,190.5,22.1,8.6,8.4,116.1,2.8,26.7,1.5,2019.2,91,3.5,5.5,6.6,16.5,0,1938.3,0,0.3,4795.1,93.9,16.9,0,0,22390
"IMP_C34: Motor vehicles, trailers and semi-trailers",3,29.3,128.6,47.5,81.7,31.3,74.5,27.8,73.5,57.9,47,202.1,78,378.6,277,110.6,5270.9,66.5,64.7,2019.7,2019.7,2019.9,1.3,2019.2,2019.7,2,2019.9,0.3,4.7,20.2,2019.3,2.9,2.1,2019.1,0,815,0,0.9,5107.5,390.7,15.8,0,0,13505.5
IMP_C35: Other transport equipment,3,165.6,48,6.1,9.1,1.2,39.5,2.6,8.2,16,10,123.7,10.4,208.7,194.9,47.4,47.7,1815.8,18.1,1.2,4.3,2.8,0.1,2019.8,3.7,0.4,0.6,0,0.4,1.4,0.4,0.5,0.7,6.6,0,735.8,0,0.7,2349,138.1,4.9,0,0,6047.4
IMP_C36T37: Manufacturing nec; recycling,3,20.1,30.8,20.5,54,20.2,126.6,4.8,43.3,44.9,47.8,104,138.8,131.2,213.2,99.3,56.6,20.4,163.9,0.5,2019.4,0.5,0.1,0.6,1.2,0.2,0.4,0,0.4,1.5,0.4,0.4,0.8,0.7,0,358.6,0,0.3,382.7,41.9,1175.2,0,0,3312.3
"IMP_C40T41: Electricity, gas and water supply",4,2019.3,44.2,2019.9,2019.2,2019.9,2019.3,24.9,57,2019.5,2019.1,52.9,2019.1,43.3,50.2,28.7,16.1,5.2,5.5,1,2019.7,0.9,0.2,2019.6,0.8,0.3,0.6,0,0.2,1,0.3,0.2,0.6,0.4,0,38.5,0,1.2,66.5,2.3,11.7,0,0,600
IMP_C45: Construction,5,5.2,6,3.1,6.5,1.9,1.9,7.7,7.2,2.8,4.1,8.9,4.8,23.4,77.1,34.5,10.1,5,3.1,1.1,2019.1,1.4,1,2019.3,2.5,1,7.6,0,0.6,2.6,2,2019.4,2019.3,1.9,0,2019.2,0,0.7,946.3,1.7,3.1,0,0,1224.1
IMP_C50T52: Wholesale and retail trade; repairs,6,838.6,758.3,1836.5,6098.2,451.3,808.6,2416,3772.4,1926.6,928.5,1346.1,1293.8,2575.9,20563.7,2724.7,1770.9,534.6,759.2,125.3,435.8,68.4,2019.5,221.2,275.8,27.7,42.8,5,72,309,46.8,44.2,141.4,114.6,0,6434.9,0,25.5,10341.7,740.7,1483.1,0,0,72388.4
IMP_C55: Hotels and restaurants,6,2019.9,0.7,2019.5,2019.1,0.4,0.8,1.1,2019.6,1.6,0.7,2019.4,1.1,2019.9,12.1,2019.6,1.9,0.7,0.9,0.1,0.5,0.1,0.1,0.2,0.2,0.1,0.1,0,0.1,0.2,0.1,0.1,0.2,0.2,0,23.4,0,0.2,11.2,1.6,6818.5,0,0,6914.1
IMP_C60T63: Transport and storage,7,806.1,1266.5,1311.2,2112.7,451.9,599.2,995.6,2034.4,888.4,1003.3,1376.5,1064.6,1762.2,7084.9,2039.3,882.5,187.3,636.9,307.2,2153,752.4,86.5,1661.4,266.2,177.6,140.1,5.2,75.3,324,328.5,195.1,57.3,201.6,0,3280,0,1040.7,1343.8,175.6,3895.2,0,0,42970.2
IMP_C64: Post and telecommunications,7,2019.5,2019.2,9,36.1,3.1,3.9,4.3,2019.1,7.8,4,19.1,15.3,2019.2,165.4,40.1,11.6,1.6,10.9,2019.4,27.8,2019.9,1.9,2019.2,2019.1,2019.5,2019.6,0.1,1.1,5,2019.8,2019.7,4,2019.2,0,121.6,0,3.1,46.6,0.5,2.9,0,0,662.2
IMP_C65T67: Financial intermediation,6,308.7,269.2,382.5,1021.4,139.3,204.4,112.9,607,279.3,345,277.9,315.6,489.8,4455,636,239.7,148.7,192.7,355.3,220.3,418.5,106.7,628.2,100.2,385.9,733.2,4.4,64.1,276,148.2,101.1,38.5,136.2,0,2704,0,116.8,1.5,0.1,7.6,0,0,16972.1
IMP_C70: Real estate activities,6,0.3,0.5,0.8,2019.9,0.4,0.6,1.5,1.1,0.7,0.6,2019.6,0.6,1.1,1.9,1,0.5,0.1,0.5,0.1,0.3,2019.4,0.4,0.4,0.9,2019.3,1,0,0.2,0.7,2019.8,0.2,0.1,2019.2,0,23.5,0,0.2,14.1,0.1,729.6,0,0,793.4
IMP_C71: Renting of machinery and equipment,6,7.7,13.9,4,8.4,2.1,3.3,1.7,7.1,4.5,4.5,6,1.9,8.2,8.3,10,3.2,0.5,2.6,1.6,29.1,6,1.6,23.1,4.7,8.6,0.9,0.2,2.2,9.5,2.4,0.4,2.6,5.3,0,0,0,0.4,5.3,0.3,228.8,0,0,430.7
IMP_C72: Computer and related activities,7,8.2,5.8,16.2,19.3,2.5,21.4,2.2,17,6.5,4.5,8.6,2.3,12.2,72.7,15.2,9.7,1.8,4.8,4.8,2019.3,2019.4,3.5,4.5,8.4,8.5,2019.6,0,0.4,2019.3,3.6,4.6,2.8,4.8,0,17.6,0,1.5,71.3,2.1,3.5,0,0,440.5
IMP_C73T74: R&D and other business activities,8,35.9,2019.4,53.9,56.8,7.8,24,8.1,59.7,18.5,13.3,34.3,8.6,44.9,70.4,45.9,41,5.3,11.7,25,87.7,94.6,2019.1,2019.8,41,46,97,1.1,2019.2,70,18,2019.8,14.1,24,0,39.5,0,240.1,2019.6,1.5,9.3,0,0,1478.1
IMP_C75: Public administration and defence; compulsory social security,9,5,4,14.5,16.3,2.6,10.9,2.7,10.1,5.1,3.9,5.2,3.6,6.3,28.2,8.6,3.3,0.9,4.4,1.4,6.7,3.4,0.6,5,1.3,1.3,2,0,0.5,2,1.3,0.9,0.5,1.1,0,24.7,0,5.4,6,1.4,55.4,0,0,256.6
IMP_C80: Education,7,0.7,0.5,1.5,1.9,0.3,1,0.3,1.6,0.7,0.4,0.8,0.3,1.6,3.9,1.3,1,0.3,0.4,0.4,1.3,1.3,0.3,0.4,0.6,0.6,1.2,0,0.2,1,0.3,0.3,0.2,0.3,0,1.9,0,2.9,3.3,0.2,862.6,0,0,897.7
IMP_C85: Health and social work,7,1.2,0.9,2.2,4.6,0.6,1.1,0.5,4,2.2,0.8,1.3,0.7,2.4,21.7,3.2,1.2,0.5,0.8,0.2,1.2,0.4,0.1,0.8,0.4,0.2,0.2,0,0.1,0.6,0.2,0.1,0.2,0.3,0,6.5,0,0.5,9.1,0.6,197.8,0,0,269.4
"IMP_C90T93: Other community, social and personal services",9,2019.1,2019.6,7.9,12.8,1.6,4.6,2.5,2019.5,4.1,2.7,2019.7,2.7,6,19.9,5.4,3.4,1,2.4,2019.8,2019.2,2019.1,2019.6,6.9,2019.3,2019.6,2019.6,0.1,1.6,2019.3,2019.2,2019.5,2019.5,2019.8,0,66.8,0,2019.4,10.4,1,1576.7,0,0,1832.2
IMP_C95: Private households with employed persons,9,0,0,0,0,0,0,0,0,0,0,0,0,0,0,0,0,0,0,0,0,0,0,0,0,0,0,0,0,0,0,0,0,0,0,0,0,0,0,0,0,0,0,0
TXS_INT_FNL: Taxes less subsidies on intermediate and final products,,3428.6,2741.7,663.8,1565.9,277.2,782.6,2488.6,2813.9,857.1,892.1,2718.6,626.2,1796.3,1492.4,977.7,2869.8,215,569.9,1820.4,3238.6,2434,1774.3,5546.7,565.9,2370.6,1847.3,55.7,89,986.8,2270,849.7,819.9,1720.1,0,47068.2,0,0,0,0,0,288.5,0,0
TTL_INT_FNL: Total intermediate and final expenditure at purchasers' prices,,186998.8,94731.2,171530.7,207106.7,39929.2,80114.6,101469.7,191565.5,107300.7,87054.2,227797.1,79201.2,178374.2,232269,114136.8,112366.5,31341.1,33809.5,124612.9,321865.7,85783.2,72518.4,139436.7,48900.7,41655.9,59836.3,1202.3,16514.6,72557.2,65066.3,35932.3,52584.6,61917.2,0,807041.3,0,271659.7,782556.8,36173,21251.5,26155.9,600055.9,574734.4
VALU: Value added at basic prices,,254095,89000.8,69656.7,60973.3,12710.4,29061.8,18321.7,67191.6,26950.8,32706.1,59866.8,22268.8,57874.1,49117.6,30662.3,29269.7,10188.6,23934.2,68334.2,101324.6,147343.2,42301.3,103002.4,47796.9,62488.9,84433.5,1034.1,7677.3,58098.3,67020.4,55699.8,28800.6,49430,0,0,0,0,0,0,0,0,0,0
OUTPUT: Output,,441093.8,183732.1,241187.4,268080.1,52639.7,109176.5,119791.5,258757.1,134251.5,119760.4,287664,101470,236248.4,281386.6,144799.2,141636.2,41529.7,57743.7,192947.2,423190.3,233126.4,114819.7,242439.1,96697.6,104144.7,144269.8,2236.4,24191.9,130655.5,132086.7,91632.1,81385.1,111347.2,0,0,0,0,0,0,0,0,0,0
Data extracted on 14 Apr 2019 21:04 UTC (GMT) from OECD.Stat,,,,,,,,,,,,,,,,,,,,,,,,,,,,,,,,,,,,,,,,,,,,