,,,,,,,,,,,,,,,,,,,,,,,,,,,,,,,,,,,,,,,,,,,,
Dataset: Input-Output Tables,,,,,,,,,,,,,,,,,,,,,,,,,,,,,,,,,,,,,,,,,,,,
Variable,,DOMIMP: Domestic output and imports,,,,,,,,,,,,,,,,,,,,,,,,,,,,,,,,,,,,,,,,,,
Country,,CHN: China (People's Republic of),,,,,,,,,,,,,,,,,,,,,,,,,,,,,,,,,,,,,,,,,,
Time,,2007,,,,,,,,,,,,,,,,,,,,,,,,,,,,,,,,,,,,,,,,,,
Unit,,"US Dollar, Millions",,,,,,,,,,,,,,,,,,,,,,,,,,,,,,,,,,,,,,,,,,
,,1,2,3,3,3,3,3,3,3,3,3,3,3,3,3,3,3,3,4,5,6,6,7,7,6,6,6,7,8,9,7,7,9,9,10,10,10,10,10,13,12,12,13
Column sector (to:),,"C01T05: Agriculture, hunting, forestry and fishing",C10T14: Mining and quarrying,"C15T16: Food products, beverages and tobacco","C17T19: Textiles, textile products, leather and footwear",C20: Wood and products of wood and cork,"C21T22: Pulp, paper, paper products, printing and publishing","C23: Coke, refined petroleum products and nuclear fuel",C24: Chemicals and chemical products,C25: Rubber and plastics products,C26: Other non-metallic mineral products,C27: Basic metals,C28: Fabricated metal products,"C29: Machinery and equipment, nec","C30T33X: Computer, Electronic and optical equipment","C31: Electrical machinery and apparatus, nec","C34: Motor vehicles, trailers and semi-trailers",C35: Other transport equipment,C36T37: Manufacturing nec; recycling,"C40T41: Electricity, gas and water supply",C45: Construction,C50T52: Wholesale and retail trade; repairs,C55: Hotels and restaurants,C60T63: Transport and storage,C64: Post and telecommunications,C65T67: Financial intermediation,C70: Real estate activities,C71: Renting of machinery and equipment,C72: Computer and related activities,C73T74: R&D and other business activities,C75: Public administration and defence; compulsory social security,C80: Education,C85: Health and social work,"C90T93: Other community, social and personal services",C95: Private households with employed persons,HFCE: Households final consumption expenditure,NPISH: Non-profit institutions serving households,GGFC: General Government final consumption,GFCF: Gross Fixed Capital Formation,INVNT: Changes in inventories,CONS_ABR: Direct purchases abroad by residents (imports),CONS_NONRES: Direct purchases by non-residents (exports),EXPO: Exports (cross border),IMPO: Imports (cross border)
Row sector (from:),,,,,,,,,,,,,,,,,,,,,,,,,,,,,,,,,,,,,,,,,,,,
"IMP_C01T05: Agriculture, hunting, forestry and fishing",1,1112.6,12.4,5848,2913,516.6,287.3,3.8,515.4,230.8,4.6,6.6,2.8,4.2,10.6,3.7,3,0.7,567,0.2,2.5,0.5,7.3,2,0.1,0.1,0,0,0.2,2019.5,0.1,0.3,0.7,0.9,0,5254.3,0,127.8,485.5,420.3,25.7,0,0,18373.1
IMP_C10T14: Mining and quarrying,2,114.5,7018.5,621.8,1086.5,260.6,483.4,37847.1,13508.2,479.7,12376.9,4554.8,14741.4,1534.9,271.7,445.6,353.4,124.5,505.1,219.5,65.5,0.8,2,2019.7,0.2,0.2,0.3,0.1,0.6,4.1,2.7,2.4,2019.4,3.2,0,267,0,0.2,24.4,1444.9,11.3,0,0,98393.1
"IMP_C15T16: Food products, beverages and tobacco",3,915,19.2,3708.5,1084.4,62.7,63.6,51.9,521.3,82.8,34.9,100.2,52.7,105.5,456.1,138.5,81.6,17.6,125.2,2019.5,5.4,2019.1,31.5,2019.7,0.8,0.5,0.5,0.1,0.6,3.8,0.9,2019.8,2019.5,6,0,6312.7,0,5.8,55.4,394.5,3431.4,0,0,17882.8
"IMP_C17T19: Textiles, textile products, leather and footwear",3,4.9,2019.9,18.7,9673.8,141.4,99.7,6.5,92.7,165,2019.5,45.4,24.2,59.3,380,122.2,146.5,10.1,394.1,2019.4,2019.9,2019.8,1,2019.1,0.8,0.4,0.6,0.1,0.9,2019.6,2019.9,0.7,2019.8,2019.1,0,3570.7,0,0.2,21.6,131.9,1033.3,0,0,16201.6
IMP_C20: Wood and products of wood and cork,3,3.3,13.4,9.5,23.1,1104.5,111.6,3.4,18.6,16.7,2019.1,210.7,6.8,45.3,103.4,47.4,2019.3,10.8,92.8,0.6,66.3,0.4,0.6,1.1,0.2,0,0.1,0,0.4,2.6,2019.1,2019.3,7.5,2019.2,0,2019.7,0,0.1,8.6,5.7,4.9,0,0,2027.2
"IMP_C21T22: Pulp, paper, paper products, printing and publishing",3,19.7,25.5,862,982.4,235.9,5855.8,11.7,673.6,413.4,383.7,523.3,29.2,250,2242.9,794.4,173,72.4,299.7,6.3,10.4,35.1,4.8,6,2019.7,2019.1,4.2,2.1,2019.2,123.4,50.4,41,2019.7,49.2,0,75.6,0,4.7,18.4,56.7,19.4,0,0,14443
"IMP_C23: Coke, refined petroleum products and nuclear fuel",3,332.2,813.5,189,467.6,92.1,173.5,1182.4,5435.9,370.5,844.2,947.7,1483.5,712.8,372.7,294.4,282.8,108.3,154,664.3,705.5,55,41.3,2622.9,27.4,46.4,77.2,5.8,52.6,337.6,183.1,90.5,52.7,147,0,292.8,0,0.5,15.4,7.2,630.9,0,0,20313.3
IMP_C24: Chemicals and chemical products,3,1971.8,521.7,488.8,8333.4,1373.1,2631.5,357.5,21245.4,14154.8,1444,2170.4,446.8,988.6,11391.7,3494.6,1220.9,408.2,1240.5,2019.6,230.8,2019.8,10,31.6,7.4,5.7,2019.6,1.9,2019.5,112.5,2019.9,2019.7,715.1,132.1,0,2941.8,0,2.4,68.1,728.5,424.9,0,0,79410.6
IMP_C25: Rubber and plastics products,3,58.1,78,384.4,482.8,85.7,403.5,13.9,599.9,2895,108,394.3,25.9,563,2964.8,1228.9,758.7,174.9,285.5,5.2,96.1,2019.8,4.4,2019.7,1.6,0.4,5.9,0.3,2.7,2019.4,1.9,6.3,6.6,2019.2,0,321.9,0,0.1,78.2,126.4,16,0,0,12255.6
IMP_C26: Other non-metallic mineral products,3,5.8,34.9,51.2,45,32.1,15.1,27.5,104.5,28.5,490.8,120.6,95.4,80.4,1500.1,304.6,73.1,13.8,72.1,1.4,207,0.4,0.4,1,0.4,0.1,0.2,0,0.3,1.8,1.3,1.6,2019.4,1,0,35.9,0,0.2,23,2.5,5.1,0,0,3381.6
IMP_C27: Basic metals,3,8,430.7,37.1,78.9,240.3,168.4,517.8,483.9,241.5,420.1,12789.4,6382,7593.8,6854.1,13426.7,3336,933.6,1036.6,10,2024.5,3.3,0.3,2019.1,0.5,0.2,2.3,0.3,2.7,17.6,0.2,3.4,1.9,8.2,0,30.1,0,0.2,76.7,499.4,11.1,0,0,57691.9
IMP_C28: Fabricated metal products,3,2019.3,61.6,52,89.2,106,92.7,20,121.7,105.6,118.4,1921.1,140.6,820.5,2392.1,1070,305.2,133.1,219.6,34,447.4,3,3.7,18.9,5.2,2,2019.9,1.8,16.4,105.4,4.1,8.7,12.5,16.8,0,146.5,0,0.3,536.8,72.7,42.2,0,0,9285.1
"IMP_C29: Machinery and equipment, nec",3,187.4,1191,153.6,845.9,234.1,292.4,355.8,871.2,481.2,599.9,3193.6,991.1,12909,4312.7,3506.6,4539.7,1934.8,78.7,119.8,715.8,26,7.8,198.4,40.3,15,15.3,1.6,14.4,92.7,15.8,16.9,317.8,21,0,87.3,0,0.8,21529.8,534.8,488.5,0,0,60938.4
"IMP_C30T33X: Computer, Electronic and optical equipment",3,51.6,436.1,101.6,281,32.9,529.3,82.4,351.6,146.9,126.3,419.2,100.6,3604.6,154643.3,7803.5,1475.4,1407.3,103.1,387.9,492.5,243.6,17.5,161.7,1643.5,126.9,105.2,62.3,568.4,3648.7,431.8,397.3,87.5,1022.3,0,12694.3,0,3.3,30759.1,2023.3,836.2,0,0,227409.6
"IMP_C31: Electrical machinery and apparatus, nec",3,8.7,177.4,48.8,155.5,43.8,111.7,21.5,116.1,79.2,60.9,406.7,91.2,2404.8,8684.3,8414,1300.2,570.9,94.4,184.6,322.7,2019.5,2019.7,9.6,98.3,3.1,2019.4,3.3,30.3,194.4,6.2,9.1,11.4,34.2,0,2297.7,0,0.3,5579.6,443.5,30.9,0,0,32103.9
"IMP_C34: Motor vehicles, trailers and semi-trailers",3,31,146.9,51.3,117.8,44.8,120.8,43.1,113.2,105.2,89.6,486.3,109.7,613.7,368.9,162.6,9539.8,110.2,130.7,2019.5,2019.8,2019.8,2.5,35.4,2019.5,2,2.9,0.6,2019.5,35.1,12.6,2019.9,3.7,2019.5,0,1591.3,0,1.1,6267.7,613.9,18,0,0,21053.9
IMP_C35: Other transport equipment,3,373.3,81.2,11.9,15.8,2.3,106.9,4.4,14.4,38.9,18.9,306.1,19,434.5,342.1,84.4,104.1,3742.6,23.5,1.9,6.2,2019.5,0.2,39.4,4.6,0.8,0.4,0.1,0.6,3.4,0.8,1.2,1.2,2019.1,0,1903.4,0,1,4229.1,285.6,7.8,0,0,12231.4
IMP_C36T37: Manufacturing nec; recycling,3,32,78.7,52.3,134.1,57.6,455.3,11.3,109.3,161.6,190.8,436.2,427.9,437.7,433.8,305.5,190.3,40.9,618.4,0.9,2019.5,0.9,0.2,0.8,1.6,0.4,0.3,0.1,0.7,2019.2,0.9,0.9,2019.1,2019.6,0,869.5,0,0.4,881.8,84.2,1373.2,0,0,7405
"IMP_C40T41: Electricity, gas and water supply",4,2019.5,51.5,2019.3,2019.8,2019.2,2019.4,52.1,78.1,20,47.8,91.9,43.2,62.9,56.9,45.9,26,8,7.6,1.6,5.9,2019.2,0.3,2019.7,0.9,0.6,0.4,0,0.3,2,0.4,0.6,0.9,0.6,0,28.3,0,1.9,62.4,4.4,6.7,0,0,790.1
IMP_C45: Construction,5,3.3,10,5.4,11.8,3,4.3,12.2,14.5,6.4,8.8,20.7,9.5,45.8,80.8,36.4,19.3,8.5,3.4,1.4,16.5,2019.4,0.7,2019.1,1.6,0.8,2019.4,0.1,0.6,2019.9,2019.9,2019.9,2019.7,2019.9,0,30.1,0,0.9,1398.3,3.7,7.2,0,0,1795.2
IMP_C50T52: Wholesale and retail trade; repairs,6,1110.3,1501.6,2981.1,8036.5,828.7,1651.3,5292.2,6886.6,3422.5,2451.9,3193.4,3068.4,4167.9,31974.1,5080.8,3121.7,934.3,1197.3,232,650.9,89.9,50.2,389.2,293.2,36.4,37.9,12.6,113.4,725.7,115.5,96.4,212.9,242,0,8362.9,0,38.1,9949.9,1207.8,2171.9,0,0,111929.6
IMP_C55: Hotels and restaurants,6,3.8,0.9,2019.6,13,0.9,1.8,1,2019.5,2019.9,2019.2,2019.2,1.8,2019.5,2019.7,2019.2,2019.7,1.6,1.6,0.2,0.8,0.2,0.2,0.3,0.2,0.1,0.1,0,0.1,0.5,0.1,0.1,0.3,0.2,0,26.9,0,0.2,11.3,2.1,9441.4,0,0,9572.1
IMP_C60T63: Transport and storage,7,910.3,1960.6,2081.7,3491.9,1072,1036.1,1722.9,3656,1629.1,1980.9,2956.8,1765.4,3311.8,12626.4,3754.1,1843.9,394.2,884.2,382.2,4328.1,1803.2,95.5,1896.8,330,244.2,59.4,10.9,99.7,640.2,456.1,348.6,97.7,319.6,0,3933.2,0,1721.4,1543.5,262.4,6612,0,0,72263.1
IMP_C64: Post and telecommunications,7,15.8,8.1,2019.4,72.1,13.6,12.1,12.2,51.5,13.7,8,2019.8,56,46.4,346,62.5,20.7,4.2,19.2,2019.2,47.6,2019.3,2019.8,13.5,2019.1,2019.2,3.5,0.2,1.6,2019.5,21,2019.2,2019.8,6.8,0,334.6,0,3.9,99.1,1,3.3,0,0,1446.6
IMP_C65T67: Financial intermediation,6,368.6,450.8,715.8,2092.4,406.7,488.3,216.3,1473.4,611.2,761.7,845.1,748.7,990.6,9653.3,1437.4,589.2,255.5,393.4,1160.8,586.9,905.5,231.8,1407.8,171.1,887.5,397,14.6,133.5,857.1,273.1,448.8,121.6,363.7,0,6766.7,0,349.3,2.2,0.1,8.3,0,0,37585.7
IMP_C70: Real estate activities,6,0.6,0.8,2.6,4,0.7,1.1,1.7,1.8,2019.2,1.2,2019.2,1.1,2019.5,2019.1,2.1,1.1,0.3,0.9,0.2,0.9,2.9,0.9,0.7,2019.2,2019.8,0.7,0,0.2,2019.6,0.5,0.5,0.3,2,0,30.1,0,0.4,19,0.3,1012.1,0,0,1107.5
IMP_C71: Renting of machinery and equipment,6,2.8,17.6,6.8,13.5,3.1,6.9,3.1,13.4,9.6,10.1,15.2,3.7,15.7,16.2,25.5,6.6,0.8,6.6,3.7,51.1,10.6,2.2,37.7,2.6,11.3,0.5,0.3,3.1,19.9,3.6,0.8,4.5,9.2,0,0,0,0.6,5.1,0.4,427.5,0,0,772
IMP_C72: Computer and related activities,7,2019.6,9.2,2019.2,31.5,4.8,45.1,4.2,31.4,11.5,8,18,4.3,2019.8,114.8,32.7,2019.6,3.4,5.7,11.8,2019.7,42.5,5.5,5.3,12.5,2019.6,10.4,0.1,0.6,36.2,4.6,12,5.9,8.9,0,27.4,0,1.8,111.9,2.5,10.8,0,0,762.7
IMP_C73T74: R&D and other business activities,8,62,47.7,107.1,108.8,2019.3,56,2019.1,129.5,37.1,2019.1,76.8,2019.6,99.5,140.1,113.1,108.8,10.1,17.7,70.4,142.9,259.9,33.3,2019.5,71.3,107.6,63.3,3.1,2019.9,179.6,2019.2,71,34.4,50.1,0,71,0,285.5,2019.4,2.5,16.5,0,0,2771.1
IMP_C75: Public administration and defence; compulsory social security,9,5.7,5.6,19.7,25.8,5.1,21.3,4.8,18.4,9.9,7.3,11.3,6.6,11.6,45.8,14.8,7.1,1.6,7.2,2.4,11,7.1,0.7,5.2,1.6,2.3,1.1,0.1,0.6,4.1,1.6,1.9,0.8,1.7,0,30.9,0,6.7,8.7,2.2,90.9,0,0,410.8
IMP_C80: Education,7,1,1,2.2,3,0.5,3,0.5,2.7,1.2,0.8,2.2,0.7,4.4,6.2,2.9,2.6,0.6,0.6,0.9,2.1,2019.2,0.4,0.6,0.9,1.3,0.8,0,0.3,2.3,0.4,0.9,0.5,0.7,0,2.2,0,3.3,5.6,0.3,1724.4,0,0,1787.1
IMP_C85: Health and social work,7,1.1,2019.1,2.9,6.1,0.9,2.8,0.7,4.9,3.1,1.3,2019.7,1.1,2019.6,26.7,5,2.1,0.7,1.2,0.3,1.9,0.8,0.1,0.9,0.4,0.3,0.1,0,0.2,1.1,0.2,0.2,0.3,0.4,0,7,0,0.6,7.2,0.8,332.9,0,0,423.8
"IMP_C90T93: Other community, social and personal services",9,5,5,2019.9,2019.6,2.8,12,5.2,2019.8,7.5,2019.5,2019.4,5.9,2019.7,35.5,11.3,7.1,1.8,4.5,5,2019.8,7.6,2019.8,7.7,2019.4,2019.8,2019.3,0.1,2019.3,2019.5,2019.4,4,2019.6,10.8,0,57.4,0,7.7,13.3,1.8,2205.9,0,0,2533.1
IMP_C95: Private households with employed persons,9,0,0,0,0,0,0,0,0,0,0,0,0,0,0,0,0,0,0,0,0,0,0,0,0,0,0,0,0,0,0,0,0,0,0,0,0,0,0,0,0,0,0,0
TXS_INT_FNL: Taxes less subsidies on intermediate and final products,,6836.7,4551.8,1281,2343.3,512.2,927.5,5241.5,4858.3,1169.5,1479.5,6040.8,1066.7,2770.4,2259,1284.1,4819.3,369.9,1270.4,3325.7,5610.4,4396.4,2687.1,9253.8,1063.7,5689.8,3753.8,85.8,136.8,1864.7,4035,1546.7,1478.9,3067.9,0,80993.9,0,0,0,0,0,118,0,0
TTL_INT_FNL: Total intermediate and final expenditure at purchasers' prices,,272509.8,202787,378548.4,420605.7,100968.3,141110.2,213945.7,350184.9,232499,213044.4,592620.7,168967.6,365765.6,499197.4,275368.6,262501.2,59159.4,68552.7,322313.5,673498.9,187008.7,123853.8,232904.7,58502.4,78737.2,41995.4,3069,27002.2,176018.6,103819.1,82066.5,103684.2,112237.2,0,1312820.2,0,473307.5,1365967.6,81849.4,32482.4,38857,1226619.9,956751.5
VALU: Value added at basic prices,,369461.3,172387.3,119858.4,104130.9,30586,41407.2,39414.5,118605.1,39767,58552.4,135929,42814.4,105737,91053.6,53793.8,51298.2,19959.6,59114.5,122986.2,195459.8,270828.6,70242.1,176926.2,82556.6,156485.6,177773.4,1948.9,15933.5,111852,117473.5,100728.8,51924.2,89972.5,0,0,0,0,0,0,0,0,0,0
OUTPUT: Output,,641971,375174.3,498406.8,524736.7,131554.3,182517.4,253360.2,468790,272266,271596.8,728549.7,211782.1,471502.5,590251,329162.4,313799.4,79119,127667.3,445299.7,868958.7,457837.3,194095.9,409830.8,141059,235222.8,219768.9,5017.9,42935.7,287870.6,221292.6,182795.2,155608.5,202209.7,0,0,0,0,0,0,0,0,0,0
Data extracted on 14 Apr 2019 21:05 UTC (GMT) from OECD.Stat,,,,,,,,,,,,,,,,,,,,,,,,,,,,,,,,,,,,,,,,,,,,